[
  {
    "id": "plasma-volume",
    "category": "central-cardiovascular",
    "label": "혈장량",
    "definition": "혈액의 액체 성분(혈장) 양의 증가. 지구력 훈련에 대한 가장 빠른 적응 중 하나다."
  },
  {
    "id": "stroke-volume",
    "category": "central-cardiovascular",
    "label": "1회 박출량",
    "definition": "심장이 한 번 박동에 내보내는 혈액량의 증가. 주로 이완기 충만 증가에서 온다."
  },
  {
    "id": "capillarization",
    "category": "peripheral-aerobic",
    "label": "모세혈관 증식",
    "definition": "근육 모세혈관 밀도의 증가로 산소·연료 전달과 대사산물 제거가 개선된다."
  },
  {
    "id": "mitochondrial-density",
    "category": "peripheral-aerobic",
    "label": "미토콘드리아 밀도",
    "definition": "근섬유 내 미토콘드리아 수·크기의 증가로 유산소 에너지 생산 용량이 커진다."
  },
  {
    "id": "lactate-clearance",
    "category": "metabolic",
    "label": "젖산 제거",
    "definition": "생성된 젖산을 제거·재활용하는 능력의 향상."
  },
  {
    "id": "mlss-shift",
    "category": "metabolic",
    "label": "MLSS 상향",
    "definition": "최대 젖산 정상상태(MLSS) 경계가 더 높은 강도로 이동하는 것 — 역치의 상향."
  },
  {
    "id": "vo2max",
    "category": "metabolic",
    "label": "최대산소섭취량",
    "definition": "최대 산소 섭취량 — 유산소 파워의 천장. 중심·말초 요인 모두에 좌우된다."
  },
  {
    "id": "glycogen-storage",
    "category": "metabolic",
    "label": "글리코겐 저장",
    "definition": "근육·간의 글리코겐 저장 용량 증가."
  },
  {
    "id": "fat-oxidation",
    "category": "metabolic",
    "label": "지방 산화",
    "definition": "주어진 강도에서 지방을 연료로 쓰는 비율의 증가로 글리코겐을 아낀다."
  },
  {
    "id": "running-economy",
    "category": "neuromuscular",
    "label": "러닝 이코노미",
    "definition": "주어진 페이스에서의 산소·에너지 소비 감소 — 같은 속도를 더 싸게."
  },
  {
    "id": "neuromuscular-recruitment",
    "category": "neuromuscular",
    "label": "신경근 동원",
    "definition": "고역치 운동단위 동원과 근수축 협응의 개선."
  },
  {
    "id": "tendon-stiffness",
    "category": "neuromuscular",
    "label": "건 강성",
    "definition": "근-건 강성 증가로 탄성 에너지 반환이 개선된다."
  },
  {
    "id": "musculoskeletal-durability",
    "category": "structural",
    "label": "근골격 내구성",
    "definition": "반복 충격에 대한 근·건·인대의 내성 증가 — 부상 저항."
  },
  {
    "id": "bone-density",
    "category": "structural",
    "label": "골밀도",
    "definition": "역학적 부하에 대한 반응으로 뼈 무기질 밀도가 증가하는 것."
  },
  {
    "id": "pacing-skill",
    "category": "skill",
    "label": "페이싱 기술",
    "definition": "레이스·세션에서 노력을 배분하는 학습된 기술. 생리적 적응이 아니라 신경·인지적 능력이라는 점에 유의."
  }
]
